{
  "id": "2d77b0c6-858f-407f-a518-58371ac9adcb",
  "title": "Promises in Node.js",
  "url": "https://www.geeksforgeeks.org/promises-in-node-js/",
  "keywords": ["JavaScript", "Async"],
  "modifiedAt": "07/13/2019",
  "publishedAt": "07/13/2019",
  "author": "03607f01-b038-4b46-9b17-50733843888f",
  "readMins": 3,
  "source": "BLOG"
}
